{
  "specVersion": "0.3",
  "kind": "dependency-observation",
  "id": "kimi-code-cli-native-agent",
  "title": "Kimi Code CLI-native coding agent architecture (v0.2.0 refresh, May 2026)",
  "source": "Extracted 2026-05-26 from MoonshotAI/kimi-code tag @moonshot-ai/kimi-code@0.2.0 commit d496fd40b649ddec1226b8f44cf1556c51178aff source tree, package manifests, and docs/en. Exact v0.2.0 tag/branch name was absent from the remote branch probe; GitHub DNS then blocked ls-remote, so the tagged local MoonshotAI/kimi-code checkout was cloned into research/repos/kimi-code. System: kimi-code. Version: 0.2.0. Edge convention: X depends on Y = X talks to, loads, invokes, configures, gates, or receives runtime results/events from Y. The schema v0.3 used by this repository forbids an extra top-level system field, so system identity is recorded here.",
  "nodes": [
    {
      "id": "kimi-cli",
      "label": "Kimi Code CLI",
      "entityType": "cli app",
      "category": "cli",
      "shortLabel": "CLI1"
    },
    {
      "id": "prompt-runner",
      "label": "Prompt/print runner",
      "entityType": "client",
      "category": "cli",
      "shortLabel": "CLI2"
    },
    {
      "id": "tui-client",
      "label": "Kimi TUI client",
      "entityType": "client",
      "category": "cli",
      "shortLabel": "CLI3"
    },
    {
      "id": "sdk-harness",
      "label": "KimiHarness SDK",
      "entityType": "sdk",
      "category": "sdk",
      "shortLabel": "SDK1"
    },
    {
      "id": "sdk-rpc",
      "label": "SDK/Core RPC bridge",
      "entityType": "protocol",
      "category": "sdk",
      "shortLabel": "SDK2"
    },
    {
      "id": "kimi-core",
      "label": "KimiCore",
      "entityType": "agent runtime",
      "category": "runtime",
      "shortLabel": "RT1"
    },
    {
      "id": "session-runtime",
      "label": "Session runtime",
      "entityType": "session",
      "category": "runtime",
      "shortLabel": "RT2"
    },
    {
      "id": "main-agent",
      "label": "Main agent",
      "entityType": "primary agent",
      "category": "runtime",
      "shortLabel": "RT3"
    },
    {
      "id": "loop-engine",
      "label": "Turn/loop engine",
      "entityType": "runtime component",
      "category": "runtime",
      "shortLabel": "RT4"
    },
    {
      "id": "provider-layer",
      "label": "Kosong provider layer",
      "entityType": "model provider",
      "category": "runtime",
      "shortLabel": "RT5"
    },
    {
      "id": "tool-manager",
      "label": "Tool manager",
      "entityType": "tool runtime",
      "category": "tools",
      "shortLabel": "TL1"
    },
    {
      "id": "builtin-tools",
      "label": "Built-in tools",
      "entityType": "tool set",
      "category": "tools",
      "shortLabel": "TL2"
    },
    {
      "id": "permission-system",
      "label": "Permission system",
      "entityType": "policy",
      "category": "tools",
      "shortLabel": "TL3"
    },
    {
      "id": "hook-engine",
      "label": "Hook engine",
      "entityType": "extension hook",
      "category": "tools",
      "shortLabel": "TL4"
    },
    {
      "id": "mcp-manager",
      "label": "MCP connection manager",
      "entityType": "tool integration",
      "category": "mcp",
      "shortLabel": "MCP1"
    },
    {
      "id": "mcp-servers",
      "label": "External MCP servers",
      "entityType": "external tool server",
      "category": "mcp",
      "shortLabel": "MCP2"
    },
    {
      "id": "background-manager",
      "label": "Background task manager",
      "entityType": "runtime component",
      "category": "runtime",
      "shortLabel": "RT6"
    },
    {
      "id": "kaos-runtime",
      "label": "Kaos execution environment",
      "entityType": "execution environment",
      "category": "runtime",
      "shortLabel": "RT7"
    },
    {
      "id": "subagent-host",
      "label": "Subagent host",
      "entityType": "agent orchestration",
      "category": "coder",
      "shortLabel": "COD1"
    },
    {
      "id": "coder-subagent",
      "label": "coder subagent",
      "entityType": "subagent",
      "category": "coder",
      "shortLabel": "COD2"
    },
    {
      "id": "explore-subagent",
      "label": "explore subagent",
      "entityType": "subagent",
      "category": "coder",
      "shortLabel": "COD3"
    },
    {
      "id": "plan-subagent",
      "label": "plan subagent",
      "entityType": "subagent",
      "category": "coder",
      "shortLabel": "COD4"
    },
    {
      "id": "skill-registry",
      "label": "Skill registry",
      "entityType": "skill runtime",
      "category": "tools",
      "shortLabel": "TL5"
    },
    {
      "id": "session-store",
      "label": "Session store",
      "entityType": "persistence",
      "category": "runtime",
      "shortLabel": "RT8"
    },
    {
      "id": "oauth-manager",
      "label": "OAuth/token manager",
      "entityType": "policy",
      "category": "runtime",
      "shortLabel": "RT9"
    },
    {
      "id": "migration-legacy",
      "label": "Legacy migration flow",
      "entityType": "runtime component",
      "category": "runtime",
      "shortLabel": "RT10"
    }
  ],
  "edges": [
    {
      "from": "kimi-cli",
      "to": "prompt-runner",
      "relation": "delegates-print-mode",
      "evidence": "research/repos/kimi-code/apps/kimi-code/src/main.ts:49-55 routes print mode to runPrompt and shell mode to runShell."
    },
    {
      "from": "kimi-cli",
      "to": "tui-client",
      "relation": "starts",
      "evidence": "research/repos/kimi-code/apps/kimi-code/src/cli/run-shell.ts:88-97 constructs KimiTUI with harness, options, workDir, theme, and migration state."
    },
    {
      "from": "kimi-cli",
      "to": "migration-legacy",
      "relation": "starts",
      "evidence": "research/repos/kimi-code/apps/kimi-code/src/main.ts:57-59 routes the kimi migrate subcommand through shell mode; research/repos/kimi-code/apps/kimi-code/src/cli/run-shell.ts:77-83 detects pending legacy migration before TUI startup."
    },
    {
      "from": "kimi-cli",
      "to": "sdk-harness",
      "relation": "constructs",
      "evidence": "research/repos/kimi-code/apps/kimi-code/src/cli/run-shell.ts:54-67 constructs KimiHarness for shell/TUI mode."
    },
    {
      "from": "prompt-runner",
      "to": "sdk-harness",
      "relation": "constructs",
      "evidence": "research/repos/kimi-code/apps/kimi-code/src/cli/run-prompt.ts:62-74 constructs KimiHarness with identity, print uiMode, skills, telemetry, and OAuth refresh handling."
    },
    {
      "from": "prompt-runner",
      "to": "session-runtime",
      "relation": "creates-or-resumes",
      "evidence": "research/repos/kimi-code/apps/kimi-code/src/cli/run-prompt.ts:154-210 resolves prompt sessions by resume, continue, or createSession before running the prompt."
    },
    {
      "from": "tui-client",
      "to": "sdk-harness",
      "relation": "uses",
      "evidence": "research/repos/kimi-code/apps/kimi-code/src/tui/kimi-tui.ts:560-573 stores a KimiHarness and session event unsubscribe state; research/repos/kimi-code/apps/kimi-code/src/tui/kimi-tui.ts:603-619 receives the harness in the KimiTUI constructor and records migration startup state."
    },
    {
      "from": "tui-client",
      "to": "session-runtime",
      "relation": "creates-resumes-prompts",
      "evidence": "research/repos/kimi-code/apps/kimi-code/src/tui/kimi-tui.ts:840-855 creates or resumes sessions through the harness; research/repos/kimi-code/apps/kimi-code/src/tui/kimi-tui.ts:1580-1601 sends prompts to Session.prompt."
    },
    {
      "from": "tui-client",
      "to": "sdk-rpc",
      "relation": "registers-handlers",
      "evidence": "research/repos/kimi-code/apps/kimi-code/src/tui/kimi-tui.ts:2004-2011 registers approval and question handlers on the active Session; research/repos/kimi-code/packages/node-sdk/src/session.ts:64-72 forwards those handlers to the SDK RPC client."
    },
    {
      "from": "tui-client",
      "to": "migration-legacy",
      "relation": "uses",
      "evidence": "research/repos/kimi-code/apps/kimi-code/src/tui/kimi-tui.ts:581-584 stores first-launch migration plan state; research/repos/kimi-code/apps/kimi-code/src/tui/kimi-tui.ts:3893-3911 mounts MigrationScreenComponent with source and target homes."
    },
    {
      "from": "sdk-rpc",
      "to": "tui-client",
      "relation": "streams-events-and-approvals-to",
      "evidence": "research/repos/kimi-code/packages/node-sdk/src/rpc.ts:434-445 stores event listeners and fans received events to them (TUI subscribes at research/repos/kimi-code/apps/kimi-code/src/tui/kimi-tui.ts:2158-2174); research/repos/kimi-code/packages/node-sdk/src/rpc.ts:447-480 stores approval handlers and calls the matching session handler for requestApproval. Single edge collapses the event-streaming and approval-routing pair into one bidirectional-bridge dependency."
    },
    {
      "from": "sdk-harness",
      "to": "sdk-rpc",
      "relation": "owns",
      "evidence": "research/repos/kimi-code/packages/node-sdk/src/kimi-harness.ts:64-71 constructs SDKRpcClient with home/config/auth/skills/telemetry options."
    },
    {
      "from": "sdk-harness",
      "to": "oauth-manager",
      "relation": "owns",
      "evidence": "research/repos/kimi-code/packages/node-sdk/src/kimi-harness.ts:58-71 constructs KimiAuthFacade and passes its OAuth token resolver into SDKRpcClient; research/repos/kimi-code/packages/node-sdk/src/auth.ts:50-68 wraps KimiOAuthToolkit for config-backed OAuth lifecycle."
    },
    {
      "from": "sdk-harness",
      "to": "session-runtime",
      "relation": "creates-resumes",
      "evidence": "research/repos/kimi-code/packages/node-sdk/src/kimi-harness.ts:100-161 creates, resumes, and forks Session wrappers through the RPC client."
    },
    {
      "from": "sdk-rpc",
      "to": "kimi-core",
      "relation": "embeds",